{
  "$schema": "../../schemas/v1.7-glaze-inspector-v1-2.schema.json",
  "schemaVersion": 1,
  "contractId": "goreecloud.glaze-ui.v1.7.glaze-inspector-v1-2",
  "name": "Glaze UI V1.7 Glaze Inspector v1.2 Development Contract",
  "version": "1.7.0-dev.32",
  "lifecycle": "Development",
  "stableBaseline": "1.6.0",
  "consumerEligible": false,
  "planVersion": "v1.2",
  "v12SpecificationSections": [39],
  "historicalFoundation": {
    "version": "1.7.0-dev.11",
    "planNumbering": "v1.1-historical-numbering",
    "historicalSpecificationSection": 26,
    "reinterpretedAsV12Section39": false
  },
  "inspectionDomains": [
    "current-motion-family",
    "transition-source-destination",
    "connected-identity-relationship",
    "duration-family",
    "easing-family",
    "motion-magnitude",
    "motion-budget",
    "reduced-motion-mapping",
    "theme-resolution",
    "semantic-color-resolution",
    "material-resolution",
    "focus-state",
    "accessibility-overrides",
    "motion-selection-explanation"
  ],
  "semanticTiming": {
    "durationFamilies": ["instant","micro","short","medium","long","ambient"],
    "easingFamilies": ["standard","enter","exit","emphasized","linear"],
    "rawDurationAccepted": false,
    "rawEasingCurveAccepted": false,
    "inspectorSelectsTiming": false,
    "untrustedObservationFallback": "unknown"
  },
  "motionMagnitude": {
    "families": ["minimal","restrained","standard","emphasized"],
    "performanceCeilingInspectable": true,
    "inspectorMayIncreaseMagnitude": false,
    "untrustedObservationFallback": "unknown"
  },
  "motionBudget": {
    "source": "V1.7 dev.24 Motion Fatigue Protection / inherited V1.6 reference budget",
    "observedCountsInspectable": true,
    "exceededDimensionsInspectable": true,
    "callerMayRaiseLimits": false,
    "callerMayOverrideBudget": false,
    "acceptanceMayBeInferred": false
  },
  "explainability": {
    "semanticRelationshipInspectable": true,
    "transitionOccurrenceAuthorityInspectable": true,
    "connectedIdentityRequirementInspectable": true,
    "reducedMotionDecisionInspectable": true,
    "performanceDegradationInspectable": true,
    "motionBudgetPressureInspectable": true,
    "themeResolutionInspectable": true,
    "semanticColorResolutionInspectable": true,
    "materialResolutionInspectable": true,
    "focusStateInspectable": true,
    "accessibilityOverridesInspectable": true,
    "sourceMutationAllowed": false,
    "missingEvidenceMayInferPass": false
  },
  "authority": {
    "boundary": "development-inspection-support-only",
    "advisoryOnly": true,
    "sourceModifiedAutomatically": false,
    "animationExecutedByInspector": false,
    "motionFamilyCreatedByInspector": false,
    "transitionTruthCreatedByInspector": false,
    "connectedIdentityCreatedByInspector": false,
    "timingAuthorityCreatedByInspector": false,
    "performanceTruthCreatedByInspector": false,
    "providerTruthCreatedByInspector": false,
    "semanticTruthCreatedByInspector": false,
    "themeTruthCreatedByInspector": false,
    "accessibilityStateCreatedByInspector": false,
    "focusStateCreatedByInspector": false,
    "acceptanceGrantedByInspector": false,
    "lifecyclePromotionAutomatic": false,
    "deploymentAcceptanceAutomatic": false,
    "productionAcceptanceAutomatic": false
  },
  "privacy": {
    "privateContentRequired": false,
    "diagnosticPayloadMinimized": true,
    "telemetryRequired": false,
    "networkRequired": false,
    "rawUserContentCapturedByDefault": false
  },
  "dependencies": {
    "historicalInspector": "1.7.0-dev.11",
    "expandedComponentSystem": "1.7.0-dev.30",
    "reducedMotionEquivalents": "1.7.0-dev.23",
    "motionFatigueProtection": "1.7.0-dev.24",
    "motionPerformance": "1.7.0-dev.25",
    "advancedThemeSystem": "1.7.0-dev.31"
  },
  "acceptanceBoundary": {
    "sourceFoundationOnly": true,
    "section39Complete": false,
    "renderedAcceptanceEstablished": false,
    "nativePlatformAcceptanceEstablished": false,
    "assistiveTechnologyAcceptanceEstablished": false,
    "measuredPerformanceAcceptanceEstablished": false,
    "representativeDeviceAcceptanceEstablished": false,
    "energyAcceptanceEstablished": false,
    "humanMotionReviewEstablished": false,
    "downstreamConsumerAcceptanceAutomatic": false,
    "releasePromotionAutomatic": false,
    "deploymentAcceptanceAutomatic": false,
    "productionAcceptanceAutomatic": false
  },
  "runtimeEntrypoint": "js/glaze-v1.7-inspector-v1-2.dev.mjs",
  "developmentAggregateEntrypoint": "js/glaze-v1.7-development.mjs",
  "tokenMap": "tokens/glaze-v1.7-inspector-v1-2.dev.json",
  "researchRecord": "research/v1.7-glaze-inspector-v1-2.md",
  "sourceAuthorities": [
    "GLAZE_UI_V1_7_PLANNED.md",
    "PLANNED-FEATURES.md",
    "IMPLEMENTED-FEATURES.md",
    "CHANGELOGS.md"
  ]
}
